{
  "pkg": "stats",
  "fn": "sample",
  "from_version": "3.5.99",
  "to_version": "3.6.9",
  "risk": "high",
  "description": "In R 3.6.0, the default RNG algorithm for sample() changed (sample.kind = 'Rejection' replaced 'Rounding'). Results produced with the same seed in R <= 3.5 will differ in R >= 3.6. Use set.seed(seed, kind = 'Mersenne-Twister', sample.kind = 'Rejection') for explicit reproducibility.",
  "reference": "https://stat.ethz.ch/R-manual/R-devel/doc/html/NEWS.3.html",
  "added_by": "ndohpenngit",
  "added_date": "2026-06-01",
  "closed": true,
  "closed_reason": "Window deliberately closed at R 3.6.9. The R 3.6.0 RNG change is a historical event <e2><80><94> all active R users (R >= 4.x) are on the same side of the change. Flagging modern R versions produces false positives. The risk only applies to teams actively comparing output between R <= 3.5 and R >= 3.6."
}
